"language","checkpoint","observation","evidence_file","status"
"zh","规则","检查 3 个页面，均需返回 200","automation-brief.md","通过"
"zh","模拟输出","结果控制在 8 行内，含异常和建议","mock-result.md","通过"
"zh","暂停条件","连续三次无异常可降频或暂停","pause-rules.md","通过"
"zh","越权检查","无发布、删除、发送或付款动作","automation-brief.md","通过"
"en","Rules","Check three pages and each must return 200","automation-brief.md","Pass"
"en","Mock output","Result stays within eight lines and includes anomalies and suggestions","mock-result.md","Pass"
"en","Pause condition","After three no-anomaly runs, reduce frequency or pause","pause-rules.md","Pass"
"en","Authority check","No publish, delete, send, or payment action","automation-brief.md","Pass"